{
  "$schema": "https://schemas.cloud-agents.dev/tools/g-contract-external-consumer/v3/source.schema.json",
  "formatVersion": "cloud-agents-g-contract-external-consumer-source/v3",
  "registryId": "cloud-agents/g-contract-external-consumer-current",
  "profileId": "g-contract-external-consumer/v3",
  "decisionId": "D-053-EC-3",
  "status": "AUTHORITY_FROZEN_REVIEW_PENDING",
  "predecessor": {
    "path": "tools/g-contract-external-consumer/v2/source.json",
    "sha256": "sha256:c1184e72ae09290e0994d3a3727d7ba75e5fc06fc23c7edfec2393beb147e595",
    "sizeBytes": 24867,
    "formatVersion": "cloud-agents-g-contract-external-consumer-source/v2"
  },
  "contractSuccessor": {
    "path": "contracts/generation.lock.successor-v3.json",
    "sha256": "sha256:63bc7d574babddd53b3f8c3bca55cc7e5971e5e91351a279d91f7512e25c9904",
    "sizeBytes": 13219,
    "outputCount": 47,
    "outputManifestSha256": "sha256:368c7a8829065285a28b98cbdba49ee4e64e432c45765bc3acf7216ac90d131c"
  },
  "semanticInputs": [
    {
      "path": ".mise.toml",
      "sha256": "sha256:be2bf934f1fde8d46e76b1a8b7a19ce7b4bb88d5ed9719b83e250497943f15af",
      "sizeBytes": 155
    },
    {
      "path": "bun.lock",
      "sha256": "sha256:c97b01255295db82df85edb7c4010ae05b6ac8d9003acfe4c703be4cea8a2de4",
      "sizeBytes": 371256
    },
    {
      "path": "contracts/common/v1alpha1/fixtures/golden/authorization-scope.json",
      "sha256": "sha256:c9605a04c9e26c5c64f2776c4056c7c66ff0ea6893f6d2b49d39d8e0aa4afe51",
      "sizeBytes": 123
    },
    {
      "path": "contracts/common/v1alpha1/fixtures/golden/idempotency.json",
      "sha256": "sha256:772e18fe6e02f294da633bbb0efae3f893c860d1023de8ad2da31e6ab585c2c6",
      "sizeBytes": 141
    },
    {
      "path": "contracts/common/v1alpha1/fixtures/golden/namespace-ref-canonical.json",
      "sha256": "sha256:d85925fd2e15e201919e3bd938ec5d7ed6f9c755a46a80041f6771dfd1122fa4",
      "sizeBytes": 383
    },
    {
      "path": "contracts/common/v1alpha1/fixtures/golden/namespace-ref-nfc.json",
      "sha256": "sha256:3d8833c55507767c0749c1e647db9db01a7de6275edd025781e887cc9974c21f",
      "sizeBytes": 72
    },
    {
      "path": "contracts/common/v1alpha1/fixtures/golden/problem.json",
      "sha256": "sha256:7df3281ac71b1986886a2ec0f665f5c9a04214bec0d617a560cc5b8b119b9b47",
      "sizeBytes": 234
    },
    {
      "path": "contracts/common/v1alpha1/fixtures/golden/subject-ref-canonical.json",
      "sha256": "sha256:d901f7e34cabe1c9a5052e7dafb8ad4d8d28e6025e5cda54d75519fc0c2cadba",
      "sizeBytes": 332
    },
    {
      "path": "contracts/common/v1alpha1/fixtures/golden/subject-ref.json",
      "sha256": "sha256:3203b8c4191517814d18db2fb900b5deff9860f35d8e530067ad916a77218534",
      "sizeBytes": 115
    },
    {
      "path": "contracts/common/v1alpha1/fixtures/golden/watch-cursor.json",
      "sha256": "sha256:e411a622baf65de543bad49984a523b6f1d5a45485f3ae74759b1ca2fd3c681f",
      "sizeBytes": 115
    },
    {
      "path": "contracts/common/v1alpha1/fixtures/manifest.json",
      "sha256": "sha256:e89a1c0fba59337a7bd49548f44dc2a6a047a4e0c13a9d81214401a1fd0eee01",
      "sizeBytes": 5568
    },
    {
      "path": "contracts/common/v1alpha1/fixtures/negative/authorization-scope-kind-mismatch.json",
      "sha256": "sha256:27505c112daae43f4fafa8a2ff24bbdd76aeedca1cddfd68d0706d249c953b9f",
      "sizeBytes": 133
    },
    {
      "path": "contracts/common/v1alpha1/fixtures/negative/idempotency-short-key.json",
      "sha256": "sha256:5f21b1e2eb6117a5b84870b9303215f55eed425e6008854170d3cf53b579065b",
      "sizeBytes": 115
    },
    {
      "path": "contracts/common/v1alpha1/fixtures/negative/namespace-ref-canonical-escape.json",
      "sha256": "sha256:b267bffca56ddd7871fe36bdb34ab574661effab3be1066142412d9f021e067e",
      "sizeBytes": 205
    },
    {
      "path": "contracts/common/v1alpha1/fixtures/negative/namespace-ref-canonical-trailing-whitespace.json",
      "sha256": "sha256:581202423f6b662843626e8239cbf91102315611cd9d938331c0c1b6a4c69ea5",
      "sizeBytes": 202
    },
    {
      "path": "contracts/common/v1alpha1/fixtures/negative/namespace-ref-decomposed.json",
      "sha256": "sha256:4c6f4c953e372f976979fdd6e26935ed59c59667b036db9ec1a8f672d600e051",
      "sizeBytes": 73
    },
    {
      "path": "contracts/common/v1alpha1/fixtures/negative/namespace-ref-extra-field.json",
      "sha256": "sha256:50f35950bfe9662cd3756a89c53a4e0c0920ec96070f7ced1e21a8ef001f4793",
      "sizeBytes": 111
    },
    {
      "path": "contracts/common/v1alpha1/fixtures/negative/namespace-ref-lone-surrogate.json",
      "sha256": "sha256:2ec1927eda960ac89f27128cdd39f6f2d8f684a41bf875cfe57f0ad59a06e954",
      "sizeBytes": 203
    },
    {
      "path": "contracts/common/v1alpha1/fixtures/negative/namespace-ref-uppercase.json",
      "sha256": "sha256:53c848e684ebbdc7690d50d9704b892d6b1fdb17667137a7095a27ccbaa4bc0b",
      "sizeBytes": 80
    },
    {
      "path": "contracts/common/v1alpha1/fixtures/negative/problem-secret-field.json",
      "sha256": "sha256:7c434f59dea9a93c45d60162c8b384cbb277b6a5f74de71960532f9fb1ffc486",
      "sizeBytes": 304
    },
    {
      "path": "contracts/common/v1alpha1/fixtures/negative/subject-ref-canonical-escape.json",
      "sha256": "sha256:06aa3f6620e79c1b63c0d1e1ff567bdb6cba1a9f881caacd0925c33fee295bf5",
      "sizeBytes": 337
    },
    {
      "path": "contracts/common/v1alpha1/fixtures/negative/subject-ref-digest-mismatch.json",
      "sha256": "sha256:50335dfda5d103a6186b65854746224dbb9ae03d41359df6b3a89bd7a4e5d0b7",
      "sizeBytes": 332
    },
    {
      "path": "contracts/common/v1alpha1/fixtures/negative/subject-ref-extra-field.json",
      "sha256": "sha256:e0d069f6e3afd1e10068123fa6e3621f94b848c65a1e210979e231cfa7573a56",
      "sizeBytes": 144
    },
    {
      "path": "contracts/common/v1alpha1/fixtures/negative/watch-cursor-extra-field.json",
      "sha256": "sha256:6956b3a67fc490582439cb49211baafa512d986d8d8648a8270043da45fff905",
      "sizeBytes": 150
    },
    {
      "path": "contracts/common/v1alpha1/schemas/authorization-scope.schema.json",
      "sha256": "sha256:de7b56abeb1f593cbada39340e7cf8c26f816afe4125204b4e37f4ae0c648a93",
      "sizeBytes": 456
    },
    {
      "path": "contracts/common/v1alpha1/schemas/idempotency-key.schema.json",
      "sha256": "sha256:1b3b7ff1710d3bd5b33e4f19cc3740f4d2a8a4d9694e2c5e3255e2cbc10a054c",
      "sizeBytes": 284
    },
    {
      "path": "contracts/common/v1alpha1/schemas/idempotency.schema.json",
      "sha256": "sha256:52338663013fe51c29a60cd551ccf0edaa16b48d2be7d143cda85dfb68e0e7b0",
      "sizeBytes": 457
    },
    {
      "path": "contracts/common/v1alpha1/schemas/identifier.schema.json",
      "sha256": "sha256:2a69fedcbb9fc9862ac53e157a427f6029af24274be8c4906857b54ff67d1e40",
      "sizeBytes": 307
    },
    {
      "path": "contracts/common/v1alpha1/schemas/namespace-ref.schema.json",
      "sha256": "sha256:2303ad9902bda5c50476c9b28d88bae708396ae413fe22321ffe4eb946978a99",
      "sizeBytes": 934
    },
    {
      "path": "contracts/common/v1alpha1/schemas/organization-authorization-scope.schema.json",
      "sha256": "sha256:16eb469069cb12684ae1a6d2ce6d4455caaed353175f9c526fe8d836c0e4ce24",
      "sizeBytes": 427
    },
    {
      "path": "contracts/common/v1alpha1/schemas/organization-ref.schema.json",
      "sha256": "sha256:3d384c4819514d684f6f60b9efae248c2a6a5decdfba6927f2822932fb081825",
      "sizeBytes": 530
    },
    {
      "path": "contracts/common/v1alpha1/schemas/page-size.schema.json",
      "sha256": "sha256:c63d4998e077392b4177365d5196f35ab022d104fdd64b312f36b7fc67ac9ded",
      "sizeBytes": 233
    },
    {
      "path": "contracts/common/v1alpha1/schemas/page-token.schema.json",
      "sha256": "sha256:983d063adb2cdfe424b05825b9e549716fb0c0e3723dfa09d96bc3076a29f6d9",
      "sizeBytes": 273
    },
    {
      "path": "contracts/common/v1alpha1/schemas/pagination.schema.json",
      "sha256": "sha256:ee3f48e61b9c9b397246e0d89a0ab46a0285826770bc8f8e3e85ce744d0fa57b",
      "sizeBytes": 412
    },
    {
      "path": "contracts/common/v1alpha1/schemas/platform-authorization-scope.schema.json",
      "sha256": "sha256:0851054b13eb7a0f11e312a8308cbbb74dc780e25b854df9fce080f8669a9ba7",
      "sizeBytes": 347
    },
    {
      "path": "contracts/common/v1alpha1/schemas/problem.schema.json",
      "sha256": "sha256:faddfae40afc8596fa0a9c7be097531de61cafa37b90b96aeeca9c0f5bf4b5b3",
      "sizeBytes": 950
    },
    {
      "path": "contracts/common/v1alpha1/schemas/project-authorization-scope.schema.json",
      "sha256": "sha256:b2cece15dc54522d87ddc70e680745495c43b62699b9a5dcb3b5c0bffcca6b3f",
      "sizeBytes": 407
    },
    {
      "path": "contracts/common/v1alpha1/schemas/project-ref.schema.json",
      "sha256": "sha256:605fc8622910d0d1e7c174f77de26a719db67f9609920005fea36a1374c691e4",
      "sizeBytes": 515
    },
    {
      "path": "contracts/common/v1alpha1/schemas/resource-metadata.schema.json",
      "sha256": "sha256:f7109567cf4d251bf858372c5e9c9b408d0a66b4b832e74c0cf1e2c7a7da92f8",
      "sizeBytes": 849
    },
    {
      "path": "contracts/common/v1alpha1/schemas/resource-version.schema.json",
      "sha256": "sha256:c6f0358af429d40f934b69059b6610e0a2b04b92d53892d64c42c0f5c1e5ad66",
      "sizeBytes": 267
    },
    {
      "path": "contracts/common/v1alpha1/schemas/stable-error.schema.json",
      "sha256": "sha256:d80b42380e728cb940f3c521376e464ce04df6c65360ec4e052c14e3d5b4212c",
      "sizeBytes": 589
    },
    {
      "path": "contracts/common/v1alpha1/schemas/subject-ref.schema.json",
      "sha256": "sha256:766e571265096b6f1a092eb587048bcfc955ddae308db22c9afd08fed5dc931c",
      "sizeBytes": 920
    },
    {
      "path": "contracts/common/v1alpha1/schemas/tenant-authorization-scope.schema.json",
      "sha256": "sha256:a685268f6949a451e1bd9e0fca67ea71c01293095a87ff57876751c7acc608a1",
      "sizeBytes": 403
    },
    {